{
 "schema": "duetsheet/0.6",
 "blocks": {
  "b-intro": {
   "id": "b-intro",
   "title": "Formulation search report (demo)",
   "caption": "",
   "breakBefore": "auto",
   "type": "text",
   "text": "This report uses **synthetic demo data**, not experimental results. It is here to try out viewing, editing and annotation.\n\n- 45 runs in 3 cycles\n- Goal: find the additive A and B combination with the highest score",
   "createdAt": "2026-09-22T00:00:00.000Z"
  },
  "b-fig1": {
   "id": "b-fig1",
   "title": "Figure 1  Optimisation progress",
   "caption": "Each point is one run; the line connects runs in order; marker shape shows the cycle.",
   "breakBefore": "auto",
   "type": "chart",
   "chart": {
    "kind": "line",
    "dataset": "exp",
    "x": "id",
    "y": "score",
    "color": "cycle",
    "logY": false,
    "yMin": null,
    "yMax": null
   },
   "createdAt": "2026-09-22T00:00:00.000Z"
  },
  "b-fig1-note": {
   "id": "b-fig1-note",
   "title": "",
   "caption": "",
   "breakBefore": "avoid",
   "type": "text",
   "text": "In Cycle 3, scores cluster between 0.7 and 0.96, clearly above the first two cycles, which suggests the search has converged on a high-scoring region.",
   "createdAt": "2026-09-22T00:00:00.000Z"
  },
  "b-fig2": {
   "id": "b-fig2",
   "title": "Figure 2  Search space",
   "caption": "Each point is one formulation; colour shows the score.",
   "breakBefore": "auto",
   "type": "chart",
   "chart": {
    "kind": "scatter",
    "dataset": "exp",
    "x": "a",
    "y": "b",
    "color": "score",
    "logY": false,
    "yMin": null,
    "yMax": null
   },
   "createdAt": "2026-09-22T00:00:00.000Z"
  },
  "b-tbl": {
   "id": "b-tbl",
   "title": "Table 1  Top 5 runs",
   "caption": "",
   "breakBefore": "auto",
   "type": "table",
   "table": {
    "dataset": "exp",
    "sortBy": "score",
    "desc": true,
    "limit": 5
   },
   "createdAt": "2026-09-22T00:00:00.000Z"
  },
  "b-img": {
   "id": "b-img",
   "title": "Figure 3  Impedance of the best formulation",
   "caption": "Synthetic Nyquist plot for the demo, not measured data.",
   "breakBefore": "auto",
   "type": "image",
   "image": {
    "src": "data:image/svg+xml;base64,PHN2ZyB4bWxucz0iaHR0cDovL3d3dy53My5vcmcvMjAwMC9zdmciIHdpZHRoPSI4MDAiIGhlaWdodD0iMzgwIiB2aWV3Qm94PSIwIDAgODAwIDM4MCI+PHJlY3Qgd2lkdGg9IjgwMCIgaGVpZ2h0PSIzODAiIGZpbGw9IiNmZmZmZmYiLz48bGluZSB4MT0iNzAiIHkxPSIzMCIgeDI9IjcwIiB5Mj0iMzMwIiBzdHJva2U9IiNkZGUzZTYiLz48dGV4dCB4PSI3MCIgeT0iMzUwIiBmb250LXNpemU9IjEyIiB0ZXh0LWFuY2hvcj0ibWlkZGxlIiBmaWxsPSIjNWE2Yjc1Ij4wPC90ZXh0PjxsaW5lIHgxPSIxNDYiIHkxPSIzMCIgeDI9IjE0NiIgeTI9IjMzMCIgc3Ryb2tlPSIjZGRlM2U2Ii8+PHRleHQgeD0iMTQ2IiB5PSIzNTAiIGZvbnQtc2l6ZT0iMTIiIHRleHQtYW5jaG9yPSJtaWRkbGUiIGZpbGw9IiM1YTZiNzUiPjEwPC90ZXh0PjxsaW5lIHgxPSIyMjIiIHkxPSIzMCIgeDI9IjIyMiIgeTI9IjMzMCIgc3Ryb2tlPSIjZGRlM2U2Ii8+PHRleHQgeD0iMjIyIiB5PSIzNTAiIGZvbnQtc2l6ZT0iMTIiIHRleHQtYW5jaG9yPSJtaWRkbGUiIGZpbGw9IiM1YTZiNzUiPjIwPC90ZXh0PjxsaW5lIHgxPSIyOTgiIHkxPSIzMCIgeDI9IjI5OCIgeTI9IjMzMCIgc3Ryb2tlPSIjZGRlM2U2Ii8+PHRleHQgeD0iMjk4IiB5PSIzNTAiIGZvbnQtc2l6ZT0iMTIiIHRleHQtYW5jaG9yPSJtaWRkbGUiIGZpbGw9IiM1YTZiNzUiPjMwPC90ZXh0PjxsaW5lIHgxPSIzNzQiIHkxPSIzMCIgeDI9IjM3NCIgeTI9IjMzMCIgc3Ryb2tlPSIjZGRlM2U2Ii8+PHRleHQgeD0iMzc0IiB5PSIzNTAiIGZvbnQtc2l6ZT0iMTIiIHRleHQtYW5jaG9yPSJtaWRkbGUiIGZpbGw9IiM1YTZiNzUiPjQwPC90ZXh0PjxsaW5lIHgxPSI0NTAiIHkxPSIzMCIgeDI9IjQ1MCIgeTI9IjMzMCIgc3Ryb2tlPSIjZGRlM2U2Ii8+PHRleHQgeD0iNDUwIiB5PSIzNTAiIGZvbnQtc2l6ZT0iMTIiIHRleHQtYW5jaG9yPSJtaWRkbGUiIGZpbGw9IiM1YTZiNzUiPjUwPC90ZXh0PjxsaW5lIHgxPSI1MjYiIHkxPSIzMCIgeDI9IjUyNiIgeTI9IjMzMCIgc3Ryb2tlPSIjZGRlM2U2Ii8+PHRleHQgeD0iNTI2IiB5PSIzNTAiIGZvbnQtc2l6ZT0iMTIiIHRleHQtYW5jaG9yPSJtaWRkbGUiIGZpbGw9IiM1YTZiNzUiPjYwPC90ZXh0PjxsaW5lIHgxPSI2MDIiIHkxPSIzMCIgeDI9IjYwMiIgeTI9IjMzMCIgc3Ryb2tlPSIjZGRlM2U2Ii8+PHRleHQgeD0iNjAyIiB5PSIzNTAiIGZvbnQtc2l6ZT0iMTIiIHRleHQtYW5jaG9yPSJtaWRkbGUiIGZpbGw9IiM1YTZiNzUiPjcwPC90ZXh0PjxsaW5lIHgxPSI2NzgiIHkxPSIzMCIgeDI9IjY3OCIgeTI9IjMzMCIgc3Ryb2tlPSIjZGRlM2U2Ii8+PHRleHQgeD0iNjc4IiB5PSIzNTAiIGZvbnQtc2l6ZT0iMTIiIHRleHQtYW5jaG9yPSJtaWRkbGUiIGZpbGw9IiM1YTZiNzUiPjgwPC90ZXh0PjxsaW5lIHgxPSI3NTQiIHkxPSIzMCIgeDI9Ijc1NCIgeTI9IjMzMCIgc3Ryb2tlPSIjZGRlM2U2Ii8+PHRleHQgeD0iNzU0IiB5PSIzNTAiIGZvbnQtc2l6ZT0iMTIiIHRleHQtYW5jaG9yPSJtaWRkbGUiIGZpbGw9IiM1YTZiNzUiPjkwPC90ZXh0PjxsaW5lIHgxPSI3MCIgeTE9IjMzMCIgeDI9Ijc1NCIgeTI9IjMzMCIgc3Ryb2tlPSIjZGRlM2U2Ii8+PHRleHQgeD0iNjAiIHk9IjMzNCIgZm9udC1zaXplPSIxMiIgdGV4dC1hbmNob3I9ImVuZCIgZmlsbD0iIzVhNmI3NSI+MDwvdGV4dD48bGluZSB4MT0iNzAiIHkxPSIyNTQiIHgyPSI3NTQiIHkyPSIyNTQiIHN0cm9rZT0iI2RkZTNlNiIvPjx0ZXh0IHg9IjYwIiB5PSIyNTgiIGZvbnQtc2l6ZT0iMTIiIHRleHQtYW5jaG9yPSJlbmQiIGZpbGw9IiM1YTZiNzUiPjEwPC90ZXh0PjxsaW5lIHgxPSI3MCIgeTE9IjE3OCIgeDI9Ijc1NCIgeTI9IjE3OCIgc3Ryb2tlPSIjZGRlM2U2Ii8+PHRleHQgeD0iNjAiIHk9IjE4MiIgZm9udC1zaXplPSIxMiIgdGV4dC1hbmNob3I9ImVuZCIgZmlsbD0iIzVhNmI3NSI+MjA8L3RleHQ+PGxpbmUgeDE9IjcwIiB5MT0iMTAyIiB4Mj0iNzU0IiB5Mj0iMTAyIiBzdHJva2U9IiNkZGUzZTYiLz48dGV4dCB4PSI2MCIgeT0iMTA2IiBmb250LXNpemU9IjEyIiB0ZXh0LWFuY2hvcj0iZW5kIiBmaWxsPSIjNWE2Yjc1Ij4zMDwvdGV4dD48bGluZSB4MT0iNzAiIHkxPSIyNiIgeDI9Ijc1NCIgeTI9IjI2IiBzdHJva2U9IiNkZGUzZTYiLz48dGV4dCB4PSI2MCIgeT0iMzAiIGZvbnQtc2l6ZT0iMTIiIHRleHQtYW5jaG9yPSJlbmQiIGZpbGw9IiM1YTZiNzUiPjQwPC90ZXh0PjxwYXRoIGQ9Ik0xNjQuNywyOTguMyBMMTY2LjcsMjkwLjQgTDE2OS45LDI4MC43IEwxNzQuNywyNjkuMCBMMTgyLjEsMjU1LjIgTDE5Mi45LDIzOS43IEwyMDguNSwyMjMuMiBMMjI5LjYsMjA3LjIgTDI1Ni40LDE5NC4zIEwyODcuNywxODYuNyBMMzIwLjgsMTg2LjQgTDM1Mi4zLDE5My40IEwzNzkuNiwyMDYuMCBMNDAxLjIsMjIxLjggTDQxNy4xLDIzOC4zIEw0MjguNCwyNTQuMCBMNDM2LjAsMjY3LjkgTDQ0MS4wLDI3OS44IEw0NDQuMiwyODkuNiBMNDQ2LjMsMjk3LjcgTDQ0Ny43LDMwNC4yIEw0NDguNSwzMDkuNSBMNDQ5LjEsMzEzLjcgTDQ0OS40LDMxNy4wIEw0NDkuNiwzMTkuNyBMNDQ5LjgsMzIxLjggTDQ0OS45LDMyMy41IEw0NDkuOSwzMjQuOCBMNDQ5LjksMzI1LjkgTDQ1MC4wLDMyNi43IEw0NTAuMCwzMjcuNCBMNDUwLjAsMzI3LjkgTDQ1MC4wLDMyOC40IEw0NTAuMCwzMjguNyBMNDUwLjAsMzI5LjAgTDQ1MC4wLDMyOS4yIEw0NTAuMCwzMjkuMyBMNDUwLjAsMzI5LjUgTDQ1MC4wLDMyOS42IEw0NTAuMCwzMjkuNyBMNDUwLjAsMzI5LjcgTDQ1MC4wLDMyOS44IEw0NTAuMCwzMjkuOCBMNDUwLjAsMzI5LjkgTDQ1MC4wLDMyOS45IEw0NTAuMCwzMjkuOSBMNDUwLjAsMzI5LjkgTDQ1MC4wLDMyOS45IEw0NTAuMCwzMzAuMCBMNDUwLjAsMzMwLjAgTDQ1MC4wLDMzMC4wIEw0NTAuMCwzMzAuMCBMNDUwLjAsMzMwLjAgTDQ1MC4wLDMzMC4wIEw0NTAuMCwzMzAuMCBMNDUwLjAsMzMwLjAgTDQ1MC4wLDMzMC4wIEw0NTAuMCwzMzAuMCBMNDUwLjAsMzMwLjAgTDQ1MC4wLDMzMC4wIEw0NTAuMCwzMzAuMCBMNDY2LjcsMzA5LjQgTDQ4My40LDI5Mi40IEw1MDAuMiwyNzkuMiBMNTE2LjksMjY2LjYgTDUzMy42LDI1MC44IEw1NTAuMywyMzEuMCBMNTY3LjAsMjEwLjAgTDU4My44LDE5MS43IEw2MDAuNSwxNzcuNiBMNjE3LjIsMTY1LjMgTDYzMy45LDE1MC42IEw2NTAuNiwxMzEuOCBMNjY3LjQsMTEwLjcgTDY4NC4xLDkxLjQgTDcwMC44LDc2LjIgTDcxNy41LDYzLjggTDczNC4yLDUwLjEgTDc1MS4wLDMyLjUiIGZpbGw9Im5vbmUiIHN0cm9rZT0iIzFGNkY4QiIgc3Ryb2tlLXdpZHRoPSIyIi8+PGNpcmNsZSBjeD0iMTY0LjciIGN5PSIyOTguMyIgcj0iMy4yIiBmaWxsPSIjMUY2RjhCIi8+PGNpcmNsZSBjeD0iMTc0LjciIGN5PSIyNjkuMCIgcj0iMy4yIiBmaWxsPSIjMUY2RjhCIi8+PGNpcmNsZSBjeD0iMjA4LjUiIGN5PSIyMjMuMiIgcj0iMy4yIiBmaWxsPSIjMUY2RjhCIi8+PGNpcmNsZSBjeD0iMjg3LjciIGN5PSIxODYuNyIgcj0iMy4yIiBmaWxsPSIjMUY2RjhCIi8+PGNpcmNsZSBjeD0iMzc5LjYiIGN5PSIyMDYuMCIgcj0iMy4yIiBmaWxsPSIjMUY2RjhCIi8+PGNpcmNsZSBjeD0iNDI4LjQiIGN5PSIyNTQuMCIgcj0iMy4yIiBmaWxsPSIjMUY2RjhCIi8+PGNpcmNsZSBjeD0iNDQ0LjIiIGN5PSIyODkuNiIgcj0iMy4yIiBmaWxsPSIjMUY2RjhCIi8+PGNpcmNsZSBjeD0iNDQ4LjUiIGN5PSIzMDkuNSIgcj0iMy4yIiBmaWxsPSIjMUY2RjhCIi8+PGNpcmNsZSBjeD0iNDQ5LjYiIGN5PSIzMTkuNyIgcj0iMy4yIiBmaWxsPSIjMUY2RjhCIi8+PGNpcmNsZSBjeD0iNDQ5LjkiIGN5PSIzMjQuOCIgcj0iMy4yIiBmaWxsPSIjMUY2RjhCIi8+PGNpcmNsZSBjeD0iNDUwLjAiIGN5PSIzMjcuNCIgcj0iMy4yIiBmaWxsPSIjMUY2RjhCIi8+PGNpcmNsZSBjeD0iNDUwLjAiIGN5PSIzMjguNyIgcj0iMy4yIiBmaWxsPSIjMUY2RjhCIi8+PGNpcmNsZSBjeD0iNDUwLjAiIGN5PSIzMjkuMyIgcj0iMy4yIiBmaWxsPSIjMUY2RjhCIi8+PGNpcmNsZSBjeD0iNDUwLjAiIGN5PSIzMjkuNyIgcj0iMy4yIiBmaWxsPSIjMUY2RjhCIi8+PGNpcmNsZSBjeD0iNDUwLjAiIGN5PSIzMjkuOCIgcj0iMy4yIiBmaWxsPSIjMUY2RjhCIi8+PGNpcmNsZSBjeD0iNDUwLjAiIGN5PSIzMjkuOSIgcj0iMy4yIiBmaWxsPSIjMUY2RjhCIi8+PGNpcmNsZSBjeD0iNDUwLjAiIGN5PSIzMzAuMCIgcj0iMy4yIiBmaWxsPSIjMUY2RjhCIi8+PGNpcmNsZSBjeD0iNDUwLjAiIGN5PSIzMzAuMCIgcj0iMy4yIiBmaWxsPSIjMUY2RjhCIi8+PGNpcmNsZSBjeD0iNDUwLjAiIGN5PSIzMzAuMCIgcj0iMy4yIiBmaWxsPSIjMUY2RjhCIi8+PGNpcmNsZSBjeD0iNDUwLjAiIGN5PSIzMzAuMCIgcj0iMy4yIiBmaWxsPSIjMUY2RjhCIi8+PGNpcmNsZSBjeD0iNDUwLjAiIGN5PSIzMzAuMCIgcj0iMy4yIiBmaWxsPSIjMUY2RjhCIi8+PGNpcmNsZSBjeD0iNTAwLjIiIGN5PSIyNzkuMiIgcj0iMy4yIiBmaWxsPSIjMUY2RjhCIi8+PGNpcmNsZSBjeD0iNTUwLjMiIGN5PSIyMzEuMCIgcj0iMy4yIiBmaWxsPSIjMUY2RjhCIi8+PGNpcmNsZSBjeD0iNjAwLjUiIGN5PSIxNzcuNiIgcj0iMy4yIiBmaWxsPSIjMUY2RjhCIi8+PGNpcmNsZSBjeD0iNjUwLjYiIGN5PSIxMzEuOCIgcj0iMy4yIiBmaWxsPSIjMUY2RjhCIi8+PGNpcmNsZSBjeD0iNzAwLjgiIGN5PSI3Ni4yIiByPSIzLjIiIGZpbGw9IiMxRjZGOEIiLz48Y2lyY2xlIGN4PSI3NTEuMCIgY3k9IjMyLjUiIHI9IjMuMiIgZmlsbD0iIzFGNkY4QiIvPjx0ZXh0IHg9IjQwMCIgeT0iMzc0IiBmb250LXNpemU9IjEzIiB0ZXh0LWFuY2hvcj0ibWlkZGxlIiBmaWxsPSIjMTMyMzJjIj5aJyAozqkpPC90ZXh0Pjx0ZXh0IHRyYW5zZm9ybT0icm90YXRlKC05MCAyMCAxODApIiB4PSIyMCIgeT0iMTgwIiBmb250LXNpemU9IjEzIiB0ZXh0LWFuY2hvcj0ibWlkZGxlIiBmaWxsPSIjMTMyMzJjIj7iiJJaJycgKM6pKTwvdGV4dD48dGV4dCB4PSI3NjAiIHk9IjUwIiBmb250LXNpemU9IjEzIiB0ZXh0LWFuY2hvcj0iZW5kIiBmaWxsPSIjYjgzYjVlIj5EZW1vIGZpZ3VyZSwgbm90IG1lYXN1cmVkPC90ZXh0Pjwvc3ZnPg==",
    "crop": {
     "t": 0,
     "r": 0,
     "b": 0,
     "l": 0
    },
    "width": 100
   },
   "createdAt": "2026-09-22T00:00:00.000Z"
  },
  "b-next": {
   "id": "b-next",
   "title": "Next steps",
   "caption": "",
   "breakBefore": "auto",
   "type": "text",
   "text": "Run additional experiments in the region A = 2–3 and B = 1.8–3.4 wt% to check whether higher scores exist.",
   "createdAt": "2026-09-22T00:00:00.000Z"
  }
 },
 "datasets": {
  "exp": {
   "id": "exp",
   "title": "Demo experiment data",
   "columns": [
    {
     "key": "id",
     "label": "Run"
    },
    {
     "key": "cycle",
     "label": "Cycle"
    },
    {
     "key": "a",
     "label": "Additive A (wt%)"
    },
    {
     "key": "b",
     "label": "Additive B (wt%)"
    },
    {
     "key": "score",
     "label": "Score"
    }
   ],
   "rows": [
    {
     "id": 1,
     "cycle": 1,
     "a": 0.25,
     "b": 1.02,
     "score": 0.109
    },
    {
     "id": 2,
     "cycle": 1,
     "a": 2.14,
     "b": 1.47,
     "score": 0.892
    },
    {